Name,Position,Institution,SubInstitution,Education,Other Affiliation,page,Contact,Notes,AffiliationId,FullName,carnegie_id,FixedPosition,StateSystem,PrimarySample
"Joseph J. Roberts, Jr",Governor,Rutgers State University Of New Jersey,,Rutgers BA; Pennsylvania 1986 MGA,,445.0,,,102322142.0,Rutgers State University Of New Jersey,186380.0,Trustee,,True
Kenneth M. Schmidt,Governor,Rutgers State University Of New Jersey,,Rutgers 1967 BA: Western New England 1969 MBA,,445.0,,,102322142.0,Rutgers State University Of New Jersey,186380.0,Trustee,,True
Daniel H. Schulman,Governor,Rutgers State University Of New Jersey,,Middlebury 1980 BA; Stern 1986 MBA,"Group President, Enterprise Growth Group, American Express Company",446.0,,,102322142.0,Rutgers State University Of New Jersey,186380.0,Trustee,,True
Candace L. Straight,Governor,Rutgers State University Of New Jersey,,,,446.0,,,102322142.0,Rutgers State University Of New Jersey,186380.0,Trustee,,True
"Robert E. ""Bob"" Baldini",Trustee,Seton Hall University,,,,,,,12524447.0,Seton Hall University,186584.0,Regent,,True
Monsignor James M. Cafone,Vice Chairman,Seton Hall University,,,"Affiliation: Vicar General and Moderator of the Curia, Archdiocese of Newark",468.0,,,12524447.0,Seton Hall University,186584.0,Board Vice President,,True
Dr. Amado Gabriel M. Esteban,Trustee,Seton Hall University,,,,468.0,,,12524447.0,Seton Hall University,186584.0,Regent,,True
Dr. Phillip Frese,Trustee,Seton Hall University,,,"Affiliation: Executive Vice President, Operations, Catholic Health and Human Services Corporation",468.0,,,12524447.0,Seton Hall University,186584.0,Regent,,True
Francis J. Hager,Trustee,Seton Hall University,,,,468.0,,,12524447.0,Seton Hall University,186584.0,Regent,,True
"Phillip N. ""Phil"" Maisano",Trustee,Seton Hall University,,Belmont Abbey 1969 BA; lona 1976 MBA,,468.0,,,12524447.0,Seton Hall University,186584.0,Regent,,True
Patrick M. Murray,Trustee,Seton Hall University,,"Seton Hall BS, MBA","Career: Chairman and Chief Executive Officer, Dresser, Inc",468.0,,,12524447.0,Seton Hall University,186584.0,Regent,,True
The Most Reverend John J. Myers,Chairman,Seton Hall University,,,"Affiliation: Archbishop, Archdiocese of Newark",468.0,,,12524447.0,Seton Hall University,186584.0,Board President,,True
Donna M. O'Brien,Trustee,Seton Hall University,,,,468.0,,,12524447.0,Seton Hall University,186584.0,Regent,,True
Rev. Mark O'Malley,Trustee,Seton Hall University,,,,468.0,,,12524447.0,Seton Hall University,186584.0,Regent,,True
Monsignor Joseph R. Reilly,Trustee,Seton Hall University,,,,468.0,,,12524447.0,Seton Hall University,186584.0,Regent,,True
The Most Reverend Arthur J. Serratelli,Trustee,Seton Hall University,,Seton Hall 1965 BA; U Gregoriana DD,"Affiliation: Bishop, Diocese of Paterson",468.0,,,12524447.0,Seton Hall University,186584.0,Regent,,True
Pamela M. Swartzberg,Secretary,Seton Hall University,,,"Affiliation: Chair, Womens Commission, Archdiocese of Newark",468.0,,,12524447.0,Seton Hall University,186584.0,Other Board Member,,True
Bruce A. Tomason,Trustee,Seton Hall University,,Seton Hall BA; Columbia 1971 MBA,,468.0,,,12524447.0,Seton Hall University,186584.0,Regent,,True
Monsignor Robert Wister,Trustee,Seton Hall University,,,,468.0,,,12524447.0,Seton Hall University,186584.0,Regent,,True
